{
  "version": "0.9.0",
  "scope_id": "TAE-COE-V0.9.0",
  "description": "Material paper and repository claims audited through v0.9.0, including the completed author-screening gate and final search-flow result.",
  "claims": [
    {
      "claim_id": "PAPER-C02",
      "claim_text": "The candidate selection rules were fixed before screening, and the first eligible case in each stratum was selected.",
      "claim_class": "methodological",
      "claim_scope": "paper",
      "status": "supported",
      "verification_rule": "The protocol must state the freeze and first-eligible rules, and the five-row register must preserve the screening order and decisions.",
      "evidence": [
        {"evidence_id": "C02-METHOD", "path": "protocols/public-case-reconstruction-protocol.md", "locator_type": "text_marker", "locator": "Select the first eligible candidate", "role": "method", "source_id": null, "run_type": "not_applicable", "integrity_state": "verified", "sha256": "9a83c6de2e550d09c5fc5b61d734be12c005ff6447ede5b3344c38093389a2e3", "content_review": "recorded"},
        {"evidence_id": "C02-SELECTION", "path": "cases/public-case-selection-register.md", "locator_type": "text_marker", "locator": "AIID-445", "role": "provenance", "source_id": null, "run_type": "not_applicable", "integrity_state": "verified", "sha256": "5dee37c58bd7338739742efc0d8dc99c7773f252743da8c6d2a0c538f040495c", "content_review": "recorded"}
      ],
      "fitness": {
        "directness": {"state": "pass", "rationale": "The protocol and register directly record the rule and its application."},
        "contemporaneity": {"state": "pass", "rationale": "The protocol freeze preceded the recorded screening decisions."},
        "independence": {"state": "outside_scope", "rationale": "This is a claim about repository records, not independent validity."},
        "completeness": {"state": "pass", "rationale": "The register preserves every decision made before the stopping condition."},
        "publication_authority": {"state": "pass", "rationale": "The repository author controls and versions the declared procedure records."}
      },
      "dependencies": [],
      "dependency_closure": "pass",
      "conclusion_eligible": true,
      "human_review": {"status": "recorded", "reviewer": "Mark Julius Banasihan", "review_date": "2026-08-09", "attestation_path": "evidence/research-activity-log.json", "note": "Reviewed as a direct repository-record claim."},
      "scope_terms": [],
      "limitations": ["The rule demonstrates procedural conformance for the recorded search and no independent discrimination test."],
      "reversal_conditions": ["An earlier eligible candidate is established or the register conflicts with the frozen protocol."]
    },
    {
      "claim_id": "PAPER-C03",
      "claim_text": "The current assessment set classifies Oko authority as partially supported and both Patriot authority states as supported.",
      "claim_class": "numerical",
      "claim_scope": "paper",
      "status": "supported",
      "verification_rule": "The authority state must equal partially supported in the v0.6 Oko assessment and supported in both preserved Patriot assessments.",
      "evidence": [
        {"evidence_id": "C03-OKO-AUTHORITY", "path": "assessments/v0.6.0/TAE-PUB-001-oko-1983.json", "locator_type": "json_pointer", "locator": "/practical_control/authority/state", "role": "numeric", "source_id": "TAE-PUB-001", "expected_value": "partially_supported", "run_type": "not_applicable", "integrity_state": "verified", "sha256": "81709fec80b42331e78c5fe3466caf93fe38ca7d72776d50f4ee700d6c5b8866", "content_review": "recorded"},
        {"evidence_id": "C03-ZG710-AUTHORITY", "path": "cases/TAE-PUB-002-patriot-zg710-2003/assessment.json", "locator_type": "json_pointer", "locator": "/practical_control/authority/state", "role": "numeric", "source_id": "TAE-PUB-002", "expected_value": "supported", "run_type": "not_applicable", "integrity_state": "release_manifest", "sha256": null, "content_review": "recorded"},
        {"evidence_id": "C03-FA18-AUTHORITY", "path": "cases/TAE-PUB-003-patriot-fa18-2003/assessment.json", "locator_type": "json_pointer", "locator": "/practical_control/authority/state", "role": "numeric", "source_id": "TAE-PUB-003", "expected_value": "supported", "run_type": "not_applicable", "integrity_state": "release_manifest", "sha256": null, "content_review": "recorded"}
      ],
      "fitness": {
        "directness": {"state": "pass", "rationale": "Each value is read from the released field asserted by the claim."},
        "contemporaneity": {"state": "outside_scope", "rationale": "The claim reports released classifications without asserting their historical protocol consistency."},
        "independence": {"state": "outside_scope", "rationale": "The claim describes author-produced assessment outputs."},
        "completeness": {"state": "pass", "rationale": "The claim includes the complete three-case set."},
        "publication_authority": {"state": "pass", "rationale": "The repository publishes and versions its own assessments."}
      },
      "dependencies": ["PAPER-C02"],
      "dependency_closure": "pass",
      "conclusion_eligible": true,
      "human_review": {"status": "recorded", "reviewer": "Mark Julius Banasihan", "review_date": "2026-08-09", "attestation_path": "paper/review-record-pr11.md", "note": "The wording is limited to released assessment states."},
      "scope_terms": [{"term": "all", "justification": "All means the complete current three-case assessment set: v0.6 Oko and two preserved v0.3 Patriot files."}],
      "limitations": ["The equality of three stored states is not evidence of independent reliability or historical truth."],
      "reversal_conditions": ["Any current authority state differs from the values stated here or the case set changes."]
    },
    {
      "claim_id": "PAPER-C04",
      "claim_text": "The frozen v0.6 Oko adjudication classifies all six practical-control stages from access through effect as partially supported under the existing evidence rule.",
      "claim_class": "documentary_classification",
      "claim_scope": "paper",
      "status": "supported",
      "verification_rule": "The v0.6 assessment must record partially supported for all six stages, and the ledger must record every transition from the preserved v0.3 assessment.",
      "evidence": [
        {"evidence_id": "C04-OKO-STATE", "path": "assessments/v0.6.0/TAE-PUB-001-oko-1983.json", "locator_type": "json_pointer", "locator": "/practical_control/effect/state", "role": "conclusion", "source_id": "TAE-PUB-001", "expected_value": "partially_supported", "run_type": "not_applicable", "integrity_state": "verified", "sha256": "81709fec80b42331e78c5fe3466caf93fe38ca7d72776d50f4ee700d6c5b8866", "content_review": "recorded"},
        {"evidence_id": "C04-LEDGER", "path": "assessments/v0.6.0/oko-change-ledger.json", "locator_type": "json_pointer", "locator": "/dependency_decision/paper_blocker_state", "role": "provenance", "source_id": "TAE-PUB-001", "expected_value": "resolved_by_reclassification", "run_type": "not_applicable", "integrity_state": "verified", "sha256": "2a4f4a166244022e19a446edbd64af0f8b562c75739219bee41508029bedb9d3", "content_review": "recorded"},
        {"evidence_id": "C04-PROTOCOL", "path": "protocols/oko-evidence-adjudication-v0.6.0.md", "locator_type": "markdown_heading", "locator": "## Stage decision procedure", "role": "method", "source_id": null, "run_type": "not_applicable", "integrity_state": "verified", "sha256": "6fef3cc0e69df173496e623c3c721fce57a7ef774dcee57ed7d93cf152f9cb52", "content_review": "recorded"}
      ],
      "fitness": {
        "directness": {"state": "pass", "rationale": "Retrospective accounts directly describe Petrov's recollection and the released assessment records the output."},
        "contemporaneity": {"state": "pass", "rationale": "The claim concerns whether the current partial classification follows the frozen v0.6 rule, not whether the historical evidence is contemporaneous."},
        "independence": {"state": "outside_scope", "rationale": "The claim reports a single-assessor procedure output and no independent historical verification."},
        "completeness": {"state": "pass", "rationale": "All six transitions and the preserved inputs are represented in the ledger."},
        "publication_authority": {"state": "pass", "rationale": "The repository author controls and versions the adjudication records."}
      },
      "dependencies": ["PAPER-C02"],
      "dependency_closure": "pass",
      "conclusion_eligible": true,
      "human_review": {"status": "recorded", "reviewer": "Mark Julius Banasihan", "review_date": "2026-08-09", "attestation_path": "reports/oko-evidence-adjudication-v0.6.0.md", "note": "Reviewed after the protocol freeze and six-stage reassessment."},
      "scope_terms": [],
      "limitations": ["The partial classification preserves missing contemporaneous evidence and supplies no independent historical verification."],
      "reversal_conditions": ["A ledger transition is missing, a frozen input hash changes, or a stage differs from the declared partial state."]
    },
    {
      "claim_id": "PAPER-C05",
      "claim_text": "The ZG710 assessment records supported authority and unsupported comprehension, feasibility, exercise, and effect.",
      "claim_class": "documentary_classification",
      "claim_scope": "paper",
      "status": "supported",
      "verification_rule": "The five declared JSON pointers must equal their stated categorical values.",
      "evidence": [
        {"evidence_id": "C05-AUTHORITY", "path": "cases/TAE-PUB-002-patriot-zg710-2003/assessment.json", "locator_type": "json_pointer", "locator": "/practical_control/authority/state", "role": "numeric", "source_id": "TAE-PUB-002", "expected_value": "supported", "run_type": "not_applicable", "integrity_state": "release_manifest", "sha256": null, "content_review": "recorded"},